{
  "schema_version": 2,
  "sample_id": "architecture.modifier-drawing",
  "sample_class": "compiled-region",
  "language": "kotlin",
  "capability_id": "modifier.drawing",
  "document_ids": ["architecture.modifier-runtime"],
  "version_lane": "released",
  "source": "samples/tutorials/src/main/java/com/viewcompose/samples/tutorials/ModifierArchitectureSamples.kt",
  "region": "modifier-drawing",
  "build_target": ":samples:tutorials:compileDebugKotlin"
}
