{
  "schema_version": 2,
  "sample_id": "tutorial.lazy-lists",
  "sample_class": "compiled-region",
  "language": "kotlin",
  "capability_id": "lazy.collections",
  "document_ids": [
    "tutorial.lazy-lists",
    "architecture.lazy-collections-runtime"
  ],
  "version_lane": "released",
  "source": "samples/tutorials/src/main/java/com/viewcompose/samples/tutorials/LazyListsTutorialActivity.kt",
  "region": "lazy-lists",
  "build_target": ":samples:tutorials:compileDebugKotlin"
}
