{
  "schema_version": 2,
  "sample_id": "module.navigation-android-presentation-retention",
  "sample_class": "compiled-region",
  "language": "kotlin",
  "capability_id": "navigation.presentation-retention",
  "document_ids": ["module.viewcompose-navigation-android"],
  "version_lane": "released",
  "source": "viewcompose-navigation-android/src/test/samples/com/viewcompose/navigation/samples/NavigationAndroidSamples.kt",
  "region": "navigation-android-presentation-retention",
  "build_target": ":viewcompose-navigation-android:compileDebugUnitTestKotlin"
}
