{
  "schema_version": 2,
  "sample_id": "migration.lazy-pager-revision",
  "sample_class": "compiled-region",
  "language": "kotlin",
  "capability_id": "lazy.collections",
  "document_ids": ["migration.lazy-collection-revision-reuse"],
  "version_lane": "released",
  "source": "samples/compose-migration/src/main/java/com/viewcompose/samples/migration/collection/ViewComposeLazyCollectionMigrationSamples.kt",
  "region": "migration-lazy-pager-revision",
  "build_target": ":samples:compose-migration:compileDebugKotlin"
}
