{
  "schema_version": 2,
  "sample_id": "guide.text-input-rich-text",
  "sample_class": "compiled-region",
  "language": "kotlin",
  "capability_id": "text.input",
  "document_ids": [
    "guide.text-input-rich-text"
  ],
  "version_lane": "released",
  "source": "samples/tutorials/src/main/java/com/viewcompose/samples/tutorials/TextInputGuideSamples.kt",
  "region": "text-input-rich-text",
  "build_target": ":samples:tutorials:compileDebugKotlin"
}
