{
  "schema_version": 2,
  "sample_id": "tutorial.theming-dependencies",
  "sample_class": "compiled-region",
  "language": "kotlin",
  "capability_id": "theme.material3",
  "document_ids": [
    "tutorial.theming"
  ],
  "version_lane": "released",
  "source": "samples/tutorials/src/main/java/com/viewcompose/samples/tutorials/TutorialDependencySnippets.kt",
  "region": "theming-dependencies",
  "build_target": ":samples:tutorials:compileDebugKotlin"
}
