{
  "schema_version": 2,
  "sample_id": "module.animation-core-converter",
  "sample_class": "compiled-region",
  "language": "kotlin",
  "capability_id": "animation.composition-motion",
  "document_ids": ["module.viewcompose-animation-core"],
  "version_lane": "released",
  "source": "viewcompose-animation-core/src/test/samples/com/viewcompose/animation/core/samples/AnimationCoreSamples.kt",
  "region": "animation-core-converter",
  "build_target": ":viewcompose-animation-core:compileTestKotlin"
}
