{
  "schema_version": 2,
  "sample_id": "project.publishing-feature-entries",
  "sample_class": "compiled-region",
  "language": "kotlin",
  "capability_id": "project.publishing",
  "document_ids": [
    "project.publishing"
  ],
  "version_lane": "released",
  "source": "samples/tutorials/src/main/java/com/viewcompose/samples/tutorials/PublishingDependencyContractSamples.kt",
  "region": "project-publishing-feature-entries",
  "build_target": ":samples:tutorials:compileDebugKotlin"
}
